title,writer,publisher,year,journal,link,abstracts
體育授業中 安全事故 類型 및 法的處理에 關한 事例硏究,배경철,檀國大學校,1992,국내석사,https://www.riss.kr/search/detail/DetailView.do?p_mat_type=be54d9b8bc7cdb09&control_no=62b385852de3d3e7&keyword=교권침해,"學校 體育은 學生들의 體力向上과 健康에 관한 一般 知識을 社會生活에 活用할 수 있도록 體系的으로 學習하는 過程으로써 學校敎育의 가장 중요한 위치를 차지하고 있음을 부인할 필요가 없을 것이다. 學校에서는 定規 體育授業時 安全을 考慮한 合理的인 指導가 實施되기는 하지만 최근 體育授業中 安全事故가 급증하고 있는 것으로 나타났다. 늘어나고 있는 傷害에 관한 硏究報告書는 대부분 說問紙 調査와 運動選手틀에 상해에 관한 한정된 硏究들이 많은 실정이다. 本 硏究者는 學校 安全共濟會의 실제로 보상처리된 資料와 법원의 體育授業中 安全事故로 인한 법적 처리된 事例를 分析하여 제시하므로 일선 體育敎師들의 安全事故의 중요성과 安全事故로 인한 法的 訴訟이 提起되었을 경우 法으로 부터 보호받을 수 있는 事例들을 제시하여 敎權侵害 事例를 줄이고, 體育授業中 安全事故를 最小化 하는데 目的을두고 1990.11.1-1991.10.2까지 硏究한 結果 다음과 같은 結論을 얻었다.
첫째, 體育 授業中 安全事故로 인한 死亡, 負傷 數가 매년 증가하고 있는 것으로 나타났다.
둘째, 體育敎師의 體罰에 의한 事故로 民事上 損害賠償請求訴訟이 提起되는 경우도 있지만 刑事上의 訴訟 對象이 되기도 하여 폭행죄 성립 여부까지 분쟁이 번지고 있다.
셋째, 體育授業中 敎師의 體罰 事故일 경우 그 體罰의 방법과 정도에는 社會觀念上 비난받지 아니할 客觀的 妥當性이 있지 않으면 法의 判決에 있어서 敎師側 敗訴事例가 상당히 많은 것으로 나타나고 있다.
넷째, 體育授業中 安全事故가 法的 保護를 받을 수 있는 것은 敎師가 자신의 注意義務와 監督義務를 다 하였을때 최대한의 法的 責任을 면하는 것으로 나타났다.
다섯째, 體育敎師가 業務上 過勞로 인하여 平素 業務에 지장이 없었던 疾病이 악화된 경우나 疾病의 주된 發生原因에 겹쳐서 재발 또는 死亡한 경우에는 公務上 災害에 해당한다. We cannot rule out the possibility that, though teachers take reasonable preventitive steps, the unexpected accidents may occur at any time in regular physical training classes due to the large number of students per class, small activity space, students' poor judgement and so on.
These days frequent safety-related accidents have endangered normal class activities. Accordingly, this thesis is to show and analyze various cases arising from the accidents in class, based on data of legal proceedings and compensation from the organizations concerned. It would helf reduce the infringement on teachers' right and minimizing accidents. This study has come to the conclusions as follows.
1. The number of the injured and dead students is on the rise.
2. Accidents from physical punishment often lead to the civil suit to collect compensation. In some cases, the problems develop into the criminal case of violence.
3. In connection with physical punishment, teachers tend to lose lawsuits unless they prove acceptable objectiveness and propriety of the measure.
4. Teachers are to be protected by law on condition that they fulfill their obligation as supervisors to the utmost.
5. As for physical training teachers, when a certain illness become worse or become a main cause of death on account of overpressure of official business, it is acknowledged to be official mishap."
효교육프로그램이 청소년 인성에 미치는 영향에 관한 연구 : 고등학생(하남시)의 효인식 조사를 중심으로,유철식,성산효대학원대학교,2017,국내박사,https://www.riss.kr/search/detail/DetailView.do?p_mat_type=be54d9b8bc7cdb09&control_no=e33322f9dc2278b7ffe0bdc3ef48d419&keyword=교권침해,"본 논문은 효교육프로그램을 갖고 학교현장에 나가 일정시간 강의 후 교육을 받은 학생들과 교육을 받지 않은 학생들 간에 인성에 대한 부분이 어떠한 차이가 있는지를 알아보기 위한 연구였다. 그 결과 앞으로의 대책을 강구하는데 보다 효과적인 효교육프로그램 개발 및 효교육 시간 배정에 대한 참고자료를 삼기위한 목적이었다.
  먼저 최근의 사회변천과 청소년의 실태를 파악하여 심각성을 알고 이에 맞는 교육내지 처방이 필요하다고 본다. 또한 청소년들의 특성과 청소년에 맞는 덕목을 이해하고 이에 부합된 효교육프로그램을 적용하는 것이 무엇보다 올바른 처방법이라고 생각된다. 효에 대한 이론적 배경을 알아보고, 인성부분에 어떠한 효교육프로그램을 적용할지를 검토하여 청소년들에게 바른 인성을 쌓는데 도움을 주어야 된다고 본다. 현재 우리나라 현실은 70년대 이후 고도의 경제성장을 이룩하여 경제규모는 세계11위(2015년 기준)로 물질의 풍요로움을 누리고 있다. 반면 사회적으로는 청소년 자살률, 이혼건수 등이 OECD 국가 중 1위이고, 국민행복지수, 출산율 등이 세계최저 수준에 와있다. 무엇보다도 심각한 것은 청소년들의 비행, 범죄추이가 해마다 증가하고 존속살해, 교권침해 등 패륜행위가 늘어난다는 점이다. 이러한 모든 것은 자기만을 생각하는 이기주의 원천에서 비롯된 것이라 볼 수 있다. 교육적인 면에서는 입시이주, 서열중심의 교육, 일류만 강조하는 교육으로 인성교육은 등한시 하여왔다. 그 결과 청소년들의 사상적 결핍과 함께 예의 없는 버릇들은 만연되어 있고, 효정신은 찾아볼 수 없게 된 지경에 이르렀다. 여기에 해결의 실마리는 입시위주의 교과편성에서 효정신에 바탕을 둔 인성교육을 강화시키는 방법만이 청소년들에게 올바른 길로 안내하는 빠른 지침이 될 것으로 본다.
  청소년들에게 다가가 마음의 문을 열게 하여 정체성을 알고 자아 존중감을 높일 수 있는 교육은 효교육일 것이다. ‘엄마’를 생각하며 부모・어른・스승을 공경하는 마음을 갖게 하는 효교육프로그램을 적용하는 것이다. 더 나아가 이웃, 국가, 자연을 사랑함으로서 광의의 하모니의 효를 실천하는 인격체로 만들도록 하는 것이다.
  효교육프로그램 내용은 하모니 효 즉, 7효를 중심으로 주제를 편성하고 이에 절제성, 예의성, 배려성을 추가하여 바른 인성형성에 도움을 주도록 하였다. 하모니 효는 일상생활에서 효정신을 바탕으로 나 자신과 타인과의 관계를 연결하는 실천적 가치요소라 볼 수 있다. 효교육프로그램 적용대상은 고등학교 1,2학년 남녀학생이었으며 연구조사 방법은 각 분야별 설문조사에 의한 방법을 택하였다. 효교육프로그램 적용시간은 년 7회였으며 창의체험학습 시간을 이용하였다. 조사항목은 내면적인 면(정서적 안정성, 절제성)과 외면적(예의, 배려)인 면을 대상으로 하였다. 그 결과 절제성과 예의, 배려성에 대해선 실험집단(효교육 받은 집단)이 통제집단(효교육을 받지 않은 집단)보다 유의미성을 찾을 수 있었다. 효도부분에서도 실험집단은 부모님 생일 기억하기, 효심 없는 친구와 사귀지 않기, 부모와 의견 충돌 시 원만한 해결 모색 등 통제집단에 비해 유의미성을 찾을 수 있었다. 이러한 결과는 효교육 시간을 학기별 최소 10회 이상 의무 교육을 시킴으로써 효의식 증진과 함께 바른 인성 함양에 빠른 지침이 될 것이라는 결론을 얻게 하였다. 더욱이 어려서부터 효교육프로그램의 적용은 더욱 효과적이라는 시사점을 보여주고 있다. 향후 시민단체와 일선학교가 연계되어 청소년들의 바른 인성함양에 단계별 프로그램 개발 및 유기적 협력체제 강화로 청소년 인성함양에 함께 노력해 나가야 된다고 본다.

<주제어> : 효교육프로그램, 청소년의 특성, 인성덕목, 인성함양, 하모니 효, 7효, 실천적 가치요소, 효도, 절제, 예의, 배려
"
흡연예방·금연실천학교 교육과정 구성 및 운영에 관한 질적사례연구,송명숙,국제뇌교육종합대학원대학교,2020,국내박사,https://www.riss.kr/search/detail/DetailView.do?p_mat_type=be54d9b8bc7cdb09&control_no=6e2fb7835abe5d59ffe0bdc3ef48d419&keyword=교권침해,"흡연예방·금연실천학교 교육과정 구성 및 운영에 관한 질적사례연구
                  
본 연구 목적은 한 중학교(이하 가칭 갈매기중학교)에서 생태체계적 관점으로‘흡연예방교육’과‘금연교육’을 결합하여 운영한‘흡연예방·금연실천학교’사례를 기술함으로써 심층적 이해에 기반한 고유한 의미와 특질을 탐색하는 것이다.
이는 세 가지 연구문제를 통해서 구체화되었다. 첫째, 갈매기중학교의 흡연예방과 금연교육과정은 어떻게 구성 및 운영되는가? 둘째, 갈매기중학교의 흡연예방과 금연교육과정 구성 및 운영에 관한 학교교육의 교육적 의미는 무엇인가? 셋째, 갈매기중학교의 흡연예방과 금연실천학교 구성 및 운영의 교육적 특질은 무엇인가? 이다. 
위와 같은 연구문제를 심층적으로 들여다 보기위하여 질적사례연구 방법론으로 접근하고 중재하며 처방적 대안을 탐색하였다. 청소년기는 환절기 같은 시기로서 성인과 아동의 공간을 공유하는 주변인으로 고민과 사연을 듣기 어려운 구조이다. 하루종일 생활하는 흡연청소년 개인의 일상생활의 어떠함은 물론이고, 학교차원의 상호작용이나 역동과 영향력 등을 알기는 매우 어려운 실정이다. 따라서 우리 사회의 주류적 규범을 일탈하고 학교교육 목표와 어긋난 흡연청소년의 일상생활과 이면 세계를 심층적으로 들여다볼 필요성에서 질적사례연구 방법론을 채용하였다.
청소년기 흡연행위는 사회적 규범을 위반하는 것과 관련되어 시간, 장소, 관계 등에서‘숨기는 몸’으로 일상이 굴절되면서 또래친구들과 군집욕구를 충족하는 과정에서 일탈행위에 빠져들고, 해당 시기 발달과업의 미완을 초래하곤 한다. 학교차원에서 흡연청소년 무리는 세(勢) 과시 행위로 인해 또래 간에는 학교폭력을, 교사에게는 교권침해을 야기하는 반학습, 반학교적인 주요교란인자로 하위문화를 형성하기에 생활지도의 대상이 되곤 한다. 여타 취약계층적 인자를 지닌 청소년들이 공적 제도권역의 보살핌을 받게 되었음에도 불구하고 흡연청소년에 대한 학교교육은 일회기성의 간헐적 관여나 징벌적 절차에 의한 추방으로, 본인은 물론이고 전체구성원에게 비의도적인 반교육적 문제해결방식을 학습케 하는 요인이 되곤 한다. 
본 연구현장은 경계가 분명한 전교생 500여명의 남녀 혼성 중학교에서 5년간 현장교사의 연구자 참여형 질적사례연구이다. 흡연청소년에게 다가간 연구초기와, 흡연청소년이 생성되는 학교환경체계와의 소통을 통한 이해 단계의 연구중기, 학교체계를 포괄적으로 조망한 연구종료기를 단계적으로 거치는 경험을 생태체계적 관점으로 기술하였다.   
1학기 학교환경구축 목표는 차분한 학습분위기를 조성하는 데 초점을 맞추었다. 관련 정보와 자원을 조직하고 중재하였기에 학교체계 관련 간접흡연예방교육의 영향력을 기대하였다고 볼 수 있다. 2학기에는 1학기에 실시했던 흡연예방교육의 내용, 즉‘처벌이 아닌 도움을 받을 수 있다’라는 안도감으로 금연을 희망하거나, 동료교사의 의뢰를 받아온 개인과 그룹 참여로 금연프로그램을 실시하였다. 흡연이나 금연하는 동안 일어나는 몸의 느낌을 알아채고 공유, 공조하며 상호협동과 격려하는 과정에서 소속감을 느끼는 공동의식소양에 초점을 둔 방식으로 접근하였다. 학교교육의 교육적 의미는 환경구축이 관건이다. 즉 취약계층아동을 중심으로 정서적 보살핌이나, 진학지도 관련 학교내외 체계 사이를 연결하는 복합교류공간으로 역할변화가 필요하다. 흡연예방·금연실천학교 구성 및 운영의 고유한 특질은 학교속성과 생리를 심층적으로 이해 가능한 현장교사의 상호신체성이 실효성을 담보하였다. 
흡연예방·금연실천학교 운영의 핵심적 특징은‘틈새형 교육과정’이라고 할 수 있다. 즉 시간을 정하거나 추가적인 부담대신 학사일정 흐름과 학교 관련 구성원이 처한 형편에 맞추어 운영하는 방식을 택하였다. 학교체계 내외 경계를 중심으로 인접환경 사이를 연결하며 비흡연과 금연 가치가 공동규범이 되도록 노력하였다. 이는 관계적인 측면에서는 공동체 지향 공동교육과정이며, 시공간과 자원체계를 모으고 분배하는 시간체계에서는 틈새형 교육과정이라고 할 수 있다. 이러한 방식은 인간이 어떻게 해볼 수 없는 무의적(無意的)의식을 느낄 수 있는 생태적 공간을 창출해서 일체감을 체험할 수 있는 기회를 늘려 가는데 초점을 맞추었다. 이는 흔적이 남아있던 길을 더듬어 발견하고, 알음알이의 적시성(適時性)으로 역동과 가능성의 흐름을 알아차리고 이어주며 흡연예방과 금연 환경을 구축하고자 하였다. 넛지 전략의 조심성(操心性)으로 진행하는 동안 아이들 또한‘이김’을 전시하고 겨루고자 상처를 주고받던 태도에서, 상호협력과 신뢰에 기반한 공동체적 분위기로 전환하는 변화를 보였다. 모든 것은 연결되어 있다는 생태적 정신을 토대로 학생중심도 교사중심도 아닌, 각각의 기관, 자원, 관계 등을 적재적소에 연결하며 상호호혜적 교류작용을 도모한 결과 위기를 겪는 흡연청소년‘한 사람’을 놓치지 않고 돌볼 수 있는 변화가능성을 보였다. 
학교는 교육적 돌봄의 체계가 조직적으로 잘 갖추어진 공간이다. 학교와 교육부는 취약계층전담부서를 두어 교육과정 일체화를 지향할 때, 흡연청소년 및 취약계층 청소년 한 명의 낙오자 없는 교육공동체의 지속가능성을 담보할 수 있을 것이다."
학교안전사고의 실태와 법적 책임에 관한 연구,강현구,전북대학교 법무대학원,2008,국내석사,https://www.riss.kr/search/detail/DetailView.do?p_mat_type=be54d9b8bc7cdb09&control_no=19aea013f0ffb6eeffe0bdc3ef48d419&keyword=교권침해,<NoAbs.>
유아교사의 인사관리 실태에 관한 조사 연구,김재환,숙명여자대학교,1989,국내석사,https://www.riss.kr/search/detail/DetailView.do?p_mat_type=be54d9b8bc7cdb09&control_no=86e5bb9fecaeaa5b&keyword=교권침해,"본 연구는 현재 우리나라 유아교사의 인사관리실태, 즉 유아교사의 신규채용 및 임용, 승진, 보수, 후생복지 빛 휴가, 근무평정, 신분 보장의 실태가 어떻게 이루어지고 있는가를 조사하고자 하였다.
연구대상은 서울시를 중심으로 사립유치원 40개기관과 유아원 18개기관, 총 58개기관에 근무하는 100명의 유아교사로 구성되었다. 이들 교사에게 사전검사 후에 작성된 유아교사의 인사관리에 관한 질문지 배부 및 면접을 실시하였다.
자료처리 및 통계적 방법은 백분률로 계산처리하였으며 유아교사들과의 면담내용은 부분적으로 설명에 추가하였다.
연구결과는 다음과 같다.
1. 유아교사의 신규채용시에 있어서 주로 면접되는 내용은 정규보수관계, 근무시간규정, 배정받게될 학급 등으로 나타났으며 실기시험내용으로는 피아노실기나 동화구연이 가장 많이 실시되고 있음이 나타났다. 신규채용의 중요기준내용은 경력이나 건강인 것으로 나타났다. 유아교사의 채용경위는 출신학과 교수추천이 가장 많았고(25%) 다음은 동료교사의 소개가 많았다. 대부분의 유아교사들은 대학 졸업후 바로 유아교육기판에 재직하고 있는 것으로(75%) 밝혀졌다.
2. 유아교사의 승진에 있어서 중요한 승진기준내용은 경력, 자격연수, 근무성적등으로 나타났으며 유아교사들이 현행 승진제도에 대한 가장 큰 불만으로 유아교육을 전공한 유아교사출신의 전문행정직 진출이 거의 없다는 점을 지적하였다.
3. 유아교사의 보수에 있어서 보수가 정해지는 경위는 교육위원회 단위에 의해 호봉제대로 지급되는 경우가(36%) 가장 많았고 다음으로 원장과 교사의 합의에 의해 정해지는 경우(33%)가 많았다. 유아교사 봉급인상의 중요기준내용은 경력과 자격연수, 근무평가, 학력상승등으로 나타났으며 각종 근무수당지급은 소수의 교사들만이 지급받고 있는 실정임이 밝혀졌다. 유아교사들의 보너스 실태를 살펴보면 유아교육기관의 형편이나 원장임의에 의해 정해지는 경우는 57%이었으며 보너스가 지급되지 않는 경우는 42%로 나타났다.
4. 유아교사의 후생복지 및 휴가에 있어서 교사들은 대체로 양호하다고 응답하였다. 교사들의 유급휴가는 특별한 기간제한이나 규정없이 필요한 사정시에만 상사의 허락을 받아 단기간 실시되고 있었으며 방학시에는 휴가와 근무가 병행되고 있는(78%) 경우가 대부분이었다.
5. 유아교사의 평가에 있어서 교사평가가 정기적으로 질시되는 경우는 12%에 불과하였으며 실시되지 않는 경우는 34%나 되었다. 교사평가의 주요기준내용은 학습지도 및 교수법, 개인의 자질태도 및 가치관등으로 나타났으며 교사평가공개는 조용히 면담식으로 교사개인애게만 공개하는 경우가 45%로 가장 많았고 자신들을 평가한 상사의 교사평가 신뢰를 보면 만족하며 자기개발이나 성장에 도움이 되고 있다는 경우는 52%로 나타났다.
6. 유아교사의 신분보장에 대해 상사로부터 교권침해나 압력·간섭등이 별로 없다는 경우가(75%) 대부분이었으며 신규채용시와의 계약은 65%가 지켜지고 있다고 응답하였다. 해임 ·해교의 주요 원인은 무능력이나 보수인상관계로 밝혀졌으며 유아교사가 결혼 후에 근무할수 있는 경우는 48%에 불과하였고 한 유아교육기관에서 장기근무할 경우에 자동퇴임시키기 위해 불이익을 주는 경우도 38%나 되는 것으로 나타났다. 따라서 유아교사들은 본연의 교육활동과 신분보장을 위한 유아교사 단체기구의 필요성을 원했다(89%).
본 연구는 서울시 일부사립유치원과 유아원교사를 대상으로 인사관리실태를 조사연구하였으므로 본 연구결과를 전체유아교육기관의 인사관리실태로 일반화시키기에는 제한점을 가지고 있다. 그러나 유아교육기관 인사관리실태에 관한 종합적인 접근을 처음 시도하였다는 점에서 본 연구의 의의를 찾고자 한다. This treatise is designed to investigate on the status of personnel management of kindergarten teachers in our country viz., employment, promotion, compensation, welfare, leave, service evaluation job security for the above mentioned kindergarten teachers.
Subjects of this research composed of 40 private kindergartens and 18 nursery schools, 58 institutions in total around Seoul area and about 100 teachers in these institutions. To these teachers questionnaires which were prepared on the basis of preliminary survey containing questions on personnel management distributed and personal inter views were conducted.
The methods for disposition of data and statistics were percentage computation and the results of interviews with the teachers were partially supplemented as explanation.
The results of the research showed the following content:
1. The main items asked during employment interview for kindergarten teachers consisted of regular pay scale, hours of work, and classes for assignment etc. The practical tests conducted during the said interview included piano practice and narration on fairy tales. Among major criteria for employment were found experiences and health condition of the candidates.
The ground for new employment was found 25% by recommendation by professors in the majoring departments, the most numerous cases, followed by introduction from other teachers. It was found that most of teachers(75%) were employed to their works immediately after their graduation from colleges.
2. The major factors considered for the promotion included experience, receiving of qualification training and performance in teaching ; one of the most critical complaints of the teachers with the current promotion system was revealed as lack of advancement of people with background of kindergarten teaching into the field of professional administrative positions.
3. Cases of payment according to the system of steps as stipulated by the Educational Committee were most numerous(36%) followed by decision on the rate of payment through mutual agreement between the teacher concerned and the head of the institute(33%). Major criteria for promotion of pay scale of the teachers included experiences, receiving of qualification training, service performance evaluation and level of educational achievements. Various allowances were found as being paid to only a small portion of the teachers. In the cases of 57% rate of bonus for the teachers were decided by the discretion of head of institute concerned while in cases of 42% no bonus was paid.
4. Most of teachers surveyed responded positively to the degree of their satisfaction with conditions of welfare and leaves. Paid leaves for the teachers were implemented during a short period with restriction on the duration under the permission of their superiors when required ; in most of cases during vacation time leaves and services were concurrently implemented(78%).
5. Regarding evaluation of teachers only 12% of cases it was found that regular evaluations were conducted while 34% of cases no such evaluation was done.
The criteria for evaluation consisted of method of teaching and instruction, quality of teachers and their value system. In most of cases in the order of 45% the results of the evaluation was revealed to the teachers concerned through personal interview with publicizing; 52% of respondents answered that they found satisfaction with the trust expressed by their superiors in the evaluation and being helped for their personal growth by such evaluation.
6. Concerning job security of the teachers in most of cases the respondents had not experiences of pressure and interference from their superiors in their education authority(75%) while 65% of them replied that contracts signed during the time of new employment are abserved. Major causes for dismissal or resigning were disqualification or question on pay raises and only 48% of them could continue to work as teachers even after marriage; 38% of the response showed that when teachers were employed for a long time at a certain kindergarten to force their voluntary resignation disadvantageous conditions were imposed against them. For this reason teachers wanted to have a certain organization for the kindergarten teachers so that their job security can be guaranteed(89%).
Since this research is conducted against kindergarten teachers in private kindergartens in Seoul area on the question of personnel management general application of its findings to all the kindergartens is limited. However since this was first attempt to find out status of personnel management of kindergarten teachers it has certain significance for producing further studies and interest in this particular field."
