title,writer,publisher,year,journal,link,abstracts
교권침해를 둘러싼 법적쟁점 분석과 교권보호방안,한정수,한국교원대학교 대학원,2010,국내석사,https://www.riss.kr/search/detail/DetailView.do?p_mat_type=be54d9b8bc7cdb09&control_no=a768e76529a0849effe0bdc3ef48d419&keyword=교권침해,"본 연구의 목적은 교권침해 실태를 파악해 봄으로써 교사의 법적 책임 범위를 명확히 하고, 교원의 권위회복 및 권리 증진 방안을 모색하는 것이다.
이를 위해 크게 두 가지 차원에서 연구를 진행하였다. 먼저 교권침해의 원인 및 현황을 침해 주체별·유형별로 나누어 살펴봄으로써 교권침해현상의 심각성을 다각적 관점에서 분석해 보았다. 다음으로 교권침해와 직·간접적 관련이 있는 판례 및 사례를 침해 주체별로 분석하여, 분쟁발생 시 판결에 영향을 미치는 주요 법적쟁점에 대해 살펴봄으로써 교육주체별 권한관계 및 책임범위에 대해 논의해 보았다.
교원의 교권침해란 교육주체자(교사, 학생, 학부모, 국가, 학교설립자 등)들의 학교 교육활동과 관련하여 교원의 법적인 교육할 권리와 사회·윤리적 권위 내지 교원의 전문적 권위를 침해 또는 무시하는 행위를 말한다. 교육권의 침해나 무시로 객관적인 피해나 손상 여부에 관계없이 당해 교원이 침해나 무시를 당하였다고 인식하게 되면 교육권이 침해되었다고 볼 수 있다는 견해도 있으나, 교육권의 침해나 무시의 여부는 피해자 교&#51408;관적 사정을 고려하되, 사회통념상 합리적인 사람이 피해자 교입장이라면 문제가 되는 행동에 대하여 어떻게 판단하였을 것인가를 함께 고려하여야 할 것으로 판단된다. 교권침해와 관련된 원인 및 현황을 살펴보면서 주목한 점은 최근 교권침해의 유형과 침해 정도가 인권침해의 수준이며, 관련사건 급증으로 인해 해당 교원의 신분적 피해는 물론 정신적 물질적 부담이 커지고 있다는 점이다.
교원의 교육권의 존재이유는 결국 학습자의 학습권의 보장에 있으며, 나아가 부모의 자녀에 대한 교육권에 실현에 있다. 따라서 교원의 교육권의 보장은 곧 학생의 학습권의 실현을 의미한다는 인식 하에 교원의 교육권이 제도적으로 보장될 수 있는 헌법 이론적 근거의 제시되어야 함은 당연한 이치이다.
하지만 오늘날의 교육제도는 전체적인 구조 속에서 교육주체자들의 권리와 의무가 복잡하게 얽혀있다. 결국 교원의 교육권의 문제는 교원 개인에게만 국한된 문제가 아니라 교육제도라는 국가적인 구조 속에서 각 교육당사자의 권한관계를 어떻게 설정하고 이를 풀어 가느냐에 달려있다고 할 수 있다.
따라서 본 연구는 교권 침해의 원인을 어느 일방으로만 바라보는 것이 아니라 교육주체들 간의 권한 충돌로 인한 모두의 잘못이라는 문제의식에 기초하여, 교육주체자간 교육권 관련 분쟁 시 판결기준이 될 수 있는 법적쟁점에 대해 논의하고자 하였다. The objective of this study is to clarify the scope of the teacher's legal responsibility and to seek ways to recover and improve the teacher's authority and privileges by understanding the status of infringement of teacher's authority and privileges.
For this, research was conducted in two different aspects. First, the seriousness of infringement of teacher's authority and privilege was analyzed in various points of views by observing the cause and current status of the infringement by entities and types. And then, precedents and cases directly and indirectly related to the infringement were analyzed categorized by the infringing entities and discussed authority relationships of educational entities and the scope of responsibilities by inspecting legal issues affecting the judicial decision.
Noticeable issue found while inspecting the cause and the status of the infringement was that the types and the seriousness of the infringement is at a level of grave concern and teachers are increasingly suffering from personal damage including mental and physical distress from such infringements. Rights and duties of educational entities(teacher, student, parents, government, school founder, etc.) are entangled within the education system of this society. Therefore, teacher's right is not only a problem limited to individual teachers but a problem depending on how to establish and control the relationships of educational entities in a national structure, education system.
The reason of the existence of the teacher's authority is to secure the students' right to learn and furthermore, to realize the parent's rights to educate their children. Therefore, in the sense that securing the right of the teachers is to realize the student's right to learn, it is a matter of course that constitutional basis to secure the teacher's right should be established. Thus, this study discussed about legal issues that can be used as a standard for judicial decision in a dispute between educational entities based on the critical mind that the infringement of teacher's authority and privileges is caused by the conflict between educational entities rather than one-sided misconduct. This is ultimately to clarify the scope of responsibility of educational entities and to recover and improve the teacher's authority and privileges."
교권침해에 관한 초등교사의 인식,오주석,금오공과대학교,2018,국내석사,https://www.riss.kr/search/detail/DetailView.do?p_mat_type=be54d9b8bc7cdb09&control_no=13466c54e5aaad36ffe0bdc3ef48d419&keyword=교권침해,"지식정보화 사회로 빠르게 움직이고 있는 현실에서 학교 현장에서 창의성과 인성을 키우기 위해 교육의 주체인 교사가 해야 할 일이 날로 커지고 있다. 이를 위해 교사는 창의성을 기를 수 있도록 교육환경을 조성하고 인성 함양을 위해 올바른 생활지도를 할 수 있는 재량권을 가지고 있어야 한다. 그러나 최근 학생인권조례 시행 등 교육 패러다임의 변화로 인해 교육의 주체가 교사에서 학생과 학부모로 전한됨에 따라 학교 안팎에서 많은 문제가 발생하고 있다. 해마다 교권침해 사례가 빠른 속도로 증가하고 있다는 사실은 이러한 문제의 심각성을 잘 반영하고 있다. 
이에 본 연구는 교권침해에 대한 초등교사들의 인식 분석을 통해 교육현장에서 발생하고 있는 교권침해의 원인과 실태를 파악함으로써 교권을 확립하기 위한 기초자료를 제시하는 것을 목적으로 하였다.
이러한 연구 목적을 달성하기 위하여 다음과 같은 연구문제를 설정하였다.
첫째, 교권과 교권보장에 대한 초등교사들의 인식은 배경변인에 따라 어떤 차이가 있는가? 둘째, 교권침해 발생 원인에 대한 초등교사들의 인식은 배경변인에 따라 어떤 차이가 있는가? 셋째, 교권확립을 위한 교사들의 요구는 배경변인에 따라 어떤 차이가 있는가? 본 연구의 문제를 해결하기 위하여 사용한 도구는 연구자가 제작한 「교권침해에 대한 초등교사의 인식 연구 설문지」이며, 설문지의 구성 내용은 교사의 교권에 대한 인식, 교권 보장 실태, 교권확립의 저해요인, 교권확립을 위한 교사의 요구로 구분하여 4개영역에서 총 28문항으로 구성하였다. 본 연구 대상은 경상북도 구미시, 상주시, 김천시, 문경시 지역에 근무하는 초등학교 교사들을 대상으로 총 300부를 배포하여 285부(95.3%)를 회수 하였고, 유효자료는 266부(87.0%)였다. 자료 통계처리는 SPSS(Statistical Package for the Social Science) 프로그램을 사용하였으며, 각 문항의 응답 결과에 대한 빈도, 백분율과 기술적 통계치를 산출하여 자료의 일반적 경향을 분석한 다음, 배경변인별로 차이를 검증하기 위하여 교차분석(-test)을 실시하였다.

본 연구의 결과를 요약하면 다음과 같다.

	1. 교권에 대한 인식 분석

  첫째, 대부분의 교사들은 교직을 수행하면서 보장받아야 할 권리에 대해 잘 알고 있는 것으로 나타났으나, 교권이 규정되어 있는 법규를 잘 알지 못한다고 반응한 교사가 비교적 많은 것으로 나타났다. 
  둘째, 교직 경력이 높을수록 교권침해 시 도움을 받을 수 있는 방법을 알고 있다고 응답하였으며, 다양한 교육 관련 단체에 대한 경험이 많아 교권확립을 위한 노력에 대해 잘 안다고 반응하였다.
  셋째, 교육경력이 많은 보직교사가 교권침해 시 대처요령에 대해 상대적으로 잘 알고 있다고 반응하였다.

	2. 교권의 보장 실태에 대한 분석

  첫째, 대부분의 교사가 학교 현장에서 교육과정 편성 및 운영권을 가지고 있으며, 교수·학습활동 방법 및 성적 평가방법을 자유롭게 결정할 수 있다고 반응하였다. 그러나 학생에 대한 징계 수단은 자유롭게 결정할 수 없다는 반응이 높게 나타났다.
  둘째, 부당한 교육외적 활동으로부터 보호되어야 할 권리와 소송 제기권, 교원단체 결성과 교섭 협의에 대한 권리가 보장되었다고 생각하는 교사가 더 많은 것으로 나타났다. 그러나 사회적 우대권에 대한 인식에서는 사회적으로 특별히 우대되어 하는 권리가 보장되어 있지 않다는 반응이 높게 나타났다.
  셋째, 대부분의 교사들이 교사의 자격과 경력, 직무에 따라 보수 책정이 적절하게 이루어져 있으며, 법률에 따라 보수(연금)를 받을 수 있는 권리와 직무수행에 소요된 경비를 실비로 변상 받을 수 있는 권리가 보장되어 있다고 반응하였다.

	3. 교권침해 요인 분석

  첫째, 교사의 교권확립을 저해하는 가장 큰 요인으로 교사를 존경하지 않는 사회적 분위기라고 반응하였다.
  둘째, 대부분의 교사가 교권침해가 발생하는 주된 이유로 학부모의 학교운영 등 부당한 요구나 간섭, 학생에 대한 가정교육의 약화, 권위적인 교직문화라고 반응하였다.
  셋째, 교권침해 시 대처방안에 대한 인식은 동료에게 조언 및 협조, 관리자에게 보고 후 지시 따름, 교원단체 교직상담실 이용, 관련 법령이나 변호사에게 법률 자문 순으로 높게 나타났다.

	4. 교권확립을 위한 교사의 요구 분석

  첫째, 대부분의 교사들이 교육관련 기관이 교육정책을 수립할 때 교사들의 의견을 반영하지 않는다는 반응을 보였다.
  둘째, 교권침해가 발생하였을 경우 적극적인 대처나 해결이 어려운 이유에 대해 신분상의 불안으로 인해 소극적으로 대응하기 때문이라는 반응이 높게 나타났다.
  셋째, 대부분의 교사가 교권침해 예방 및 교권확립을 위해 교권에 관한 법 규정의 엄격한 이행 및 제재, 교사를 존경하는 사회적 분위기, 정부의 교원 우대정책이 필요하다고 반응하였으며, 이를 위해 교사는 전문성 향상을 위해 노력해야 하며, 학교는 교권전담상담(변호사) 창구 마련해야 한다는 반응이 높게 나타났다. The purpose of this study was to present basic data for the establishment of teachers' authority through analysis of the teachers' perception of the violation of educational authority.
  The tool used to solve the problems of this study is a ""A Survey on the Elementary Teachers' Recognition of Infraction of Education Rights"" produced by the researchers. A total of 285 copies (95.3%) were distributed to elementary school teachers working in Gumi, Sangju, Gimcheon, and Mungyeong and 266 copies (87.0%) were available. The SPSS for statistical data processing was used. Cross-analysis was conducted in order to verify the difference by the background variables.

  The results of this study are summarized as follows.

  First, teachers were found to be well aware of the rights to be guaranteed in the performance of the teaching profession, and the higher the teaching experience, the better the way and how to cope with the violation of teacher authority. However, a relatively large number of teachers said they were not aware of the laws prescribed by the teachers' authority, while those with limited experience responded that they were not aware of the law. Thus, in order to address this problem, it is necessary to prepare institutional mechanisms such as the creation of various training programs for teachers to participate with interest in the violation of teacher authority and the establishment of teacher authority.
  Secondly, teachers responded that the educational, social and property rights of teachers, as defined under the current law, were well guaranteed. However, there was a high response that a disciplinary measure against students was not freely determined, and that the right to social preference was not guaranteed. Therefore, a universal and reasonable manual should be developed to discipline students and institutional mechanisms should be provided to increase teachers' welfare benefits.
  Third, most teachers are currently subject to violation of the authority of teachers, and the main reason for the violation is parents' unreasonable demand or intervention in school operation, weakening the perception of students, and an authoritative culture. On the other hand, many people said that they asked their colleagues for advice and cooperation on how to deal with the violation of the authority of teachers. Therefore, in order to prevent infringement of teachers' rights, parents should be allowed to participate in school operation according to official procedures, and the development of programs to foster personality through the guidance of households. Also, it is necessary to operate the school curriculum through smooth communication between teachers and school administrators.
  Fourth, teachers said that if there was an violation of teachers' authority, they were forced to take a passive response to the need to take active action or resolve the problem due to social unrest, and that it was necessary to prevent and establish the provisions. In order to address this problem, teachers should make efforts to improve their expertise, and schools should prepare devices that allow teachers to receive practical help, such as counseling exclusively for teachers' rights. Social incentives should also be prepared to ease social unrest."
교권침해 피해교사들의 심리적 외상과 상담을 통한 회복 경험,조유경,이화여자대학교,2020,국내박사,https://www.riss.kr/search/detail/DetailView.do?p_mat_type=be54d9b8bc7cdb09&control_no=16d894abc5228280ffe0bdc3ef48d419&keyword=교권침해,"The purpose of this study is to understand the psychological trauma of teachers who experienced teachers right infringement, and explaining their therapeutic factors during the counseling process.
In-depth interviews with 8 teachers who experienced teachers right infringement were conducted in this study. Interviewees were selected by theoretical sampling method and they were elementary (or middle school) teachers who had been through a counseling for traumatic experience of teachers right infringement by the day of data acquisition. 
Following the grounded theory analysis suggested by Corbin and Strauss (2008), the process of open-coding, axis-coding was adopted in this study and all the data were collected and analyzed at the same time. Repetitive comparison and questioning strategies were utilized throughout all the process of data collection and analysis in order to keep the level of theoretical sensitivity.
As the result of open-coding, 129 of concepts, 46 of sub-categories, 21 of categories of major themes were finally drawn. By the result of axis-coding, the central phenomenon of paradigm model, which represents the psychological trauma of teachers who experienced teachers right infringement, was identified as the experiences of ‘facing the fragmented myself as a person before a teacher’, ‘feeling the lonely myself having been insulated from school relationships’, and ‘feeling inappropriate myself as a teacher’.
The causal conditions which caused the central phenomenon were revealed to be ‘insults and violence by student challenging the authority as a teacher’, ‘infringements of authority and harassment by parents to vent their spleen’, and ‘failure to be cared and compulsion to obey their authority by supervisors’. 
The contextual conditions which influenced the central phenomenon were revealed to be ‘paralyzed reactions by peer teachers’, ‘harder pains caused by supervisor than by the attacker’, ‘sense of helplessness and realistic panic from the situational limits’, ‘ignorance of the culture of teacher by family members and friends’, and ‘severe standards for a teacher by the society’.
The intervening conditions promoting the action/interaction strategies were revealed to be ‘social support’, ‘understanding the specialties of teacher by the counselor’, ‘understandings and recognitions of counseling’, and ‘passions for growth’.
The action/interaction strategies, coping with trauma within the counseling process, were revealed to be ‘to be with the person who is holding myself’, ‘to face the case together’, ‘to understand myself through the case’. Finally, ‘rediscovery of myself before a teacher’, ‘reform of capabilities as a teacher’, and ‘growth with student’ were identified to be the results of recovery process of strategic counseling.
The victims of teachers right infringement experienced complex trauma and their self-systems were damaged by the aftereffects. Supervisors, who were lack of sensitivity in teachers right infringement, proved to be an important contextual cause of visual symptoms. As being teachers the victims suffered harder by the severe standards of the society because it was proved to accelerate secondary emotional reactions as shame, guilty, rage from the visual symptoms. 
Understandings and recognitions of counseling were identified to have important influences on their decision process to get counseling. The victims were able to begin recover within in-depth sympathetic relationships in which they were truly understood and accepted by the counselor. And, they faced and expressed their painful emotions as the very first step above all to recover. The objective observation of the case was connected to deep understanding of themselves and nourished the change and growth afterwards. 
The victims were healed from the trauma through the social support from supervisors and peers while they were recognized to be valuable person and feel intimacy of being connected to others. Meanwhile, with counseling the victims of teachers right infringement, it is proved that the counselor should understand the specialties of culture of teachers and consider their anxiety about social stigma and confidentiality. The victims were proved to build new identification of themselves through the experience of counseling.
With all the results above, this study suggests an empirical ground to interpret the recovery process through counseling of victims of teachers right infringement and it presents implications not only for developing psychotherapy and counseling program of victims of teachers right infringement but for counselor training. 본 연구의 목적은 교권침해 피해교사들의 심리적 외상과 상담을 통한 회복 경험을 이해하고자 하는 것이다. 
본 연구에서는 교권침해 피해교사 8명을 대상으로 심층 인터뷰를 진행하였다. 연구의 참여자는 이론적 표본추출방법을 적용하여 선정하였으며 연구참여자 포함기준은 자료수집 일을 기준으로 교권침해 피해로 인해 상담을 받고 종결한 경험이 있는 초·중등 교사들을 대상으로 하였다.
자료 분석은 Corbin과 Strauss(2008)가 제시한 근거이론 연구방법을 사용하여 개방 코딩, 축코딩 과정을 거쳐서 진행하였으며 자료의 수집과 분석은 동시에 이루어졌다. 자료수집과 분석과정 전반에 걸쳐 끊임없이 비교하고 질문하는 전략을 활용하여 이론적 민감성을 유지하였다.
연구결과 개방 코딩 과정에서 최종적으로 129개의 개념, 46개의 하위범주, 21개의 범주가 도출되었다. 축코딩의 결과로서 패러다임 모형의 중심현상은 교권침해 피해교사들이 경험하는 심리적 외상을 나타내는 것으로 교사 이전에 한 인간으로서 깨어진 자기를 만남, 학교 관계에서 단절되어가는 외로운 자기를 경험, 교사로서 부적절한 자기를 느낌으로 확인되었다. 중심 현상의 원인이 되는 인과적 조건으로는 학생들로부터 교사의 권위에 도전받으며 모욕과 폭력을 당함, 학부모로부터 교사의 권위를 침해받고 화풀이 대상으로 괴롭힘을 당함, 관리자에게 보호받지 못하고 권위에 복종하도록 강요받음으로 확인되었다. 중심현상에 영향을 미치는 맥락적 조건으로는 동료 교사들의 경직된 반응, 가해 주체보다 더 큰 고통을 주는 관리자, 상황적 한계에서 오는 무력감과 현실적 공포, 교직 문화를 이해하지 못하는 가족과 친구, 교사에 대한 가혹한 사회적 잣대로 확인되었다. 작용/상호작용 전략을 촉진하는 중재적 조건으로는 사회적 지지, 상담자의 교직의 특수성에 대한 이해, 상담에 대한 이해와 인식, 성장에 대한 내 안의 열망으로 확인되었다. 심리적 외상 경험에 대처하는 상담 과정 안에서의 작용/상호작용 전략은 온전히 나를 담아주는 대상과 함께하기, 사건을 함께 직시하기, 사건을 통해 나 자신을 이해하기로 확인되었다. 마지막으로 상담의 결과로 교사 이전의 자신에 대한 재발견, 교사로서 자신의 역량 재형성, 학생과 함께 성장이 확인되었다
교권침해로 피해교사들이 경험하는 외상은 복합외상으로의 성격을 띄는 것으로 확인되었고 이로 인한 후유증으로 자기체계의 손상을 경험하고 있는 것으로 나타났다. 교권침해에 대해 감수성이 부족한 관리자는 피해교사들의 외상 경험의 중요한 맥락적 요인이었으며 피해교사들은 교사라는 대상에게 사회적으로 기대되는 엄격한 잣대로 인해 더 큰 고통을 받았는데 이는 외상에서 비롯되는 수치심과 죄책감, 분노와 같은 2차 정서 반응을 더욱 활성화시키는 역할을 하는 것으로 확인되었다. 
교권침해 피해교사들이 상담을 받기 위해 결정하는 과정에서는 교사들의 상담에 대한 이해와 인식이 중요한 영향을 미치는 것으로 나타났다. 피해교사들은 상담자에게 자기가 진정으로 이해되고 수용 받는 깊은 공감적 관계 안에서 회복을 시작할 수 있었다. 또한, 자신의 고통스러운 정서를 직면하고 표현하는 과정이 상처의 회복에서 가장 선행되어야 할 과정이었으며 피해교사들의 사건에 대한 객관적 조망은 자기 자신에 대한 깊은 이해로 연결되었고 변화와 성장을 위한 중요한 밑거름이 되고 있음을 확인하였다. 피해교사들은 관리자와 동료와 같은 사회적 지지를 통해 자신이 가치 있는 존재로 인정받고 타인과 연결되는 친밀감을 느끼면서 외상에서 회복되어갔음이 확인되었다. 한편 피해교사들의 외상 회복을 위한 상담에서는 교직 문화를 제대로 이해하고 있는 상담자의 전문성이 중요하며 피해교사들이 상담에 대한 도움추구를 활성화하기 위해 사회적 낙인과 비밀보장에 대한 염려에 대한 고려가 중요한 것으로 나타났다. 교권침해 피해교사들은 상담의 경험을 통해 자신의 정체성을 새롭게 형성해 나가고 있는 것으로 나타났다.
이상의 결과를 통해 본 연구는 교권침해 피해교사들이 경험하는 심리적 외상을 이해하고 상담을 통한 회복과정을 해석할 수 있는 실증적인 근거를 마련하였으며, 이후, 교권침해 피해교사들의 회복을 위한 상담심리치료와 상담프로그램 개발뿐만 아니라 상담자 훈련을 위한 기초자료를 마련하였다는 데 의의가 있다."
