title,writer,publisher,year,journal,link,abstracts
교권 보호 정책 변화에 대한 역사적 신제도주의적 분석,이해니,서울대학교 대학원,2019,국내석사,https://www.riss.kr/search/detail/DetailView.do?p_mat_type=be54d9b8bc7cdb09&control_no=1b22858f5465af76ffe0bdc3ef48d419&keyword=교권침해,"The purpose of this study is to examine changes in the protection policy of teachers and to explore factors that have affected the change and then to identify the pattern of changes in the policy. To analyze this, historical neo-institutionalism views were utilized to analyze the system based on the basis of history and context. The government has implemented teacher protection policies to address the ever-increasing problem of teachers' rights, but their effectiveness is not high. Therefore, this study intended to draw up suggestions for effective policies for protecting teachers' rights through a diachronic analysis of changes in the policies for protecting teachers' rights.
  For the analysis, three research questions were set. 
First, what is the process of changing the teachers' rights protection policy? Second, what factors have affected the change in the teachers' rights protection policy? Third, what is the pattern of the path change of the protection policy? 
  For this study, the period was divided into the period of job security(`49~`80), the period of status improvement(`81~00), the period of construction of safety network(`01~`08), and the period of violation response(`09~`17) based on common characteristics of the teachers' rights protection policy. And a case study was conducted to collect and search various literature related to teachers' rights protection policy. 
  The main findings of this study are as follows. First, the change in the teachers' right protection policy is presented in terms of goals, content and methods, performance and limitations as follows. The goals of the teachers' rights protection policy gradually shifted from the initial job security and status improvement to the direction of educational rights protection. The contents of the policy for protection of teachers' rights have changed from the direction of job security → status improvement → establishment of safety net → direction of violation response and from the perspective of declarative and formal to specific and systematic aspects. The policy method was mainly enacted legislation, and gradually the roles of the city and provincial education offices and schools were increased more than the roles of the government. In addition, policies for protection of teachers' rights have achieved some success in terms of guaranteeing teachers' job and status, and guaranteeing teachers' right to education has been gradually strengthened, while teachers' authority and basic human rights have been determined to limit their lack of legal binding or effectiveness. 
  Second, the factors of change in the teachers' rights protection policy were selected by dividing them into structural, institutional and behavioral factors, and structural factors was social changes into knowledge and information society, institutional factors were legislation and ideology and behavioral factors were the government, the National Assembly, and teachers' organizations. Through analysis, this study identified that the policy for protection of teachers' rights changed from a policy for securing identity and improving status to a policy for establishing a safety net and responding to encroachment through interaction between structural, institutional and behavioral factors. The interaction between the government, the National Assembly, and teachers' groups, which are actors' factors, has also affected the change in the policy. In addition, the Korean Federation of Teachers' Associations(KFTA) exerted more influence than the Korean Teachers and Education Workers' Union, which contributed greatly to the establishment of most policy protecting teachers' rights.
  Third, the path change in the protection policy of teachers' rights was sustained and hardened in terms of the protection of teachers' identity and status, but since the establishment of the 「Law of Education」 in 1949, the trend of path evolution protecting teachers' education rights was detected starting with the 「Guidelines on the honorable treatment of teachers」in the late 1980s and continued to be seen from 2000. In addition, the path evolution of the policy for protection of teachers' rights was mainly in the form of drift and layering.
  Based on the results, followings were discussed. First, the lack of educational authority and basic human rights assurance in relation to the change in the protection of teachers' rights policy is due to the fact that authority is not something to be acknowledged but something to be acknowledged by the entity. Also, the lack of awareness of basic human rights of teachers is due to the lack of respect for teachers' human rights in the legalization and enforcement of the law. 
  Second, in relation to the factors of change in the protection of teachers' rights are as follows. The interaction of structural, institutional, and actor factors has changed the protection policy of teachers' rights, which can be explained by an integrated approach to of historical neo-institutionalism, which is designed to analyze the phenomenon through interaction among actors, system and structures, as the system alone has limitations in explaining complex and diverse phenomena. Also, the close interaction of the actors' factors - the government, the National Assembly, and teachers' groups - can be seen as an iron triangle, a phenomenon in which the three parties of the administration, the National Assembly Standing Committee, and interest groups build close ties to control policy processes while excluding participation by other groups. And the Korea Federation of Teachers' Association(KFTA) had much influence on the change in the protection of teachers' rights than the the Korean Teachers and Education Workers' Union, which have historically been unfairly distributed so that KFTA has more power than the Korean Teachers and Education Workers' Union. This study identified this in terms of the imbalances in the power relationship between actors assumed in historical neo-institutionalism. 
  Third, the change in the path of the protection policy was discussed gradually change and at the discretion of the route operator. When recognizing a system as a complex consisting of various elements, it can be understood that the protection policy of teachers' rights has been gradually changed by adding elements of protection of educational rights to existing components to solve problems, which have traditionally been composed of elements of job security and status improvement. And the path evolution types of teachers' rights protection policy, which are mostly path operators have changed gradually to lower the discretion of the government and increase the role of city and provincial education offices and schools, in line with the trend of shifting policy enforcement to decentralization rather than centralization.
  Based on this, the following policy suggestions were presented. First, the protection of teachers' authority should be supported by the teacher's professional growth policy. Second, it is necessary to raise the social awareness of basic human rights of teachers. Third, there should be no difference in the guarantee of teachers' rights by region. 이 연구는 교권 보호 정책의 변화를 살펴보고 정책 변화에 영향을 미친 요인을 탐색한 후 정책의 변화 양상을 파악하는 것을 목적으로 한다. 이를 분석하기 위하여 역사와 맥락에 기반하여 제도를 분석하는 역사적 신제도주의 관점을 활용하였다. 정부에서는 지속적으로 증가하는 교권 침해 문제를 해결하기 위해 교권 보호 정책을 시행하고 있으나, 그 효과가 높지 않다. 또한 기존 연구들은 이제까지 실시되었던 교권 보호 정책의 전반적인 변천 과정을 면밀하게 탐색하여 분석하지 않았다는 한계를 노정한다. 따라서 이 연구에서는 교권 보호 정책 변화의 통시적 분석을 통해 실효성 있는 교권 보호 정책을 위한 시사점을 도출하고자 하였다.  
  이 연구의 연구문제는 다음과 같다. 
첫째, 교권 보호 정책의 변천 과정은 어떠한가?
둘째, 교권 보호 정책 변화에 영향을 미친 요인은 무엇인가?
셋째, 교권 보호 정책의 경로 변화 양상은 어떠한가?
  이를 위해 교권 보호 정책의 공통적인 특징을 바탕으로 신분 보장기(`49∼`80), 지위 향상기(`81∼`00), 안전망 구축기(`01∼`08), 침해 대응기(`09∼`17)의 시기로 구분하였다. 그리고 교권 보호 정책과 관련된 다양한 문헌들을 분석 대상으로 수집하여 탐색하는 사례 연구를 수행하였다. 
  이 연구의 주요 결과는 다음과 같다. 첫째, 교권 보호 정책의 변천을 목표, 내용 및 방식, 성과 및 한계 측면에서 제시하면 다음과 같다. 교권 보호 정책이 표방한 목표는 당초 신분 보장 및 지위 향상에서 점차 교육권 보장의 방향으로 전환되었다. 교권 보호 정책의 내용은 신분 보장 → 지위 향상 → 안전망 구축 → 침해 대응의 방향으로, 선언적ㆍ형식적 측면에서 구체적ㆍ체계적 측면으로 변화하였다. 정책의 방식은 주로 법제화되어 실시되었으며, 정부 차원의 역할보다 점차 시ㆍ도 교육청과 학교 차원의 역할이 증대되는 방향으로 변모되었다. 아울러 교권 보호 정책은 교원의 신분 및 지위 보장 측면에서 어느 정도 성과를 거두었고 교원의 교육권 보장도 점차 강화되고 있는 반면, 교원의 권위와 기본적 인권 측면에서는 법적 구속력이 약하거나 실효성이 낮은 한계를 노정하였다.
  둘째, 교권 보호 정책의 변화 요인을 구조ㆍ제도ㆍ행위자 요인으로 구분하여 살펴보았는데, 구조적 요인으로는 지식 정보화 사회로의 사회적 변화를, 제도적 요인은 법령과 신자유주의 이념을, 행위자 요인은 정부, 국회, 교직단체, 학부모단체를 선정하였다. 이를 통해 교권 보호 정책은 구조ㆍ제도ㆍ행위자 요인 간의 상호작용을 통해 신분 보장 및 지위 향상 측면의 정책에서 안전망 구축과 침해 대응 측면의 정책으로 변화함을 파악하였다. 또한 행위자 요인가운데 정부, 국회, 교직단체 간 상호작용이 교권 보호 정책 변화에 주요한 영향을 미쳤다. 덧붙여 교직단체 가운데 한국교총이 전교조보다 큰 영향력을 행사하였는데, 대부분의 교권 보호 정책이 수립되는 데에 많은 기여를 하였다. 
  셋째, 교권 보호 정책의 경로 변화는 1949년「교육법」의 제정으로 형성된 교원의 신분 보장 및 지위 향상 측면에서의 교권 보호 정책의 경로가 지속되고 고착화되었으나, 1980년대 후반 「교원예우에 관한 지침」을 시작으로 교원의 교육권을 보호하는 경로진화의 양상이 포착되었고 2000년부터는 경로진화의 면모를 유지하는 양상을 띠었다. 아울러 교권 보호 정책의 경로진화는 주로 표류와 가겹의 형태로 발생하였다. 
  이 연구결과에 대한 논의는 다음과 같다. 첫째, 교권 보호 정책의 변천과 관련하여 교원의 교육적 권위와 기본적 인권 보장이 미비한 이유는 권위가 그것을 인정받아야 할 대상이 주장할 수 있는 것이 아니라 인정하고자 하는 주체가 실현시키는 속성을 지녔기 때문이다. 또한 교원의 기본적 인권에 대한 인식이 미비하여 교권의 법제화와 법 집행 과정에서 교원의 인권을 존중하는 태도가 부족한 점에서 기인한다. 
  둘째, 교권 보호 정책의 변화 요인과 관련해서는 다음과 같다. 먼저 구조ㆍ제도ㆍ행위자 요인 간의 상호작용으로 교권 보호 정책이 변화하였는데, 이는 제도만으로 복잡하고 다양한 현상을 설명하는 데에 한계가 있어 행위자와 구조를 포괄하여 이들 간의 상호작용을 통해 현상을 분석하고자 한 역사적 신제도주의의 구조-제도-행위자 요인의 통합적 접근으로 설명될 수 있다. 또한 행위자 요인가운데 정부, 국회, 교직단체의 밀접한 상호작용은 행정기관, 국회 상임위원회, 이익집단의 삼자가 긴밀한 유대관계를 구축하여 다른 집단의 참여를 배제하면서 정책과정을 장악하는 현상인 철의 삼각 모형으로 볼 수 있다. 그리고 한국교총이 전교조보다 교권 보호 정책 변화에 많은 영향을 미쳤는데, 이는 역사적으로 교총과 전교조 간 권력이 불공평하게 배분되어 교총이 전교조보다 더 강한 권력을 지닌 것으로 역사적 신제도주의에서 가정하는 행위자 간 권력관계의 불균형 측면에서 파악하였다. 
  셋째, 교권 보호 정책의 경로 변화는 점진적 변화와 경로 운영자의 재량 수준에 대하여 논의하였다. 제도를 다양한 요소로 구성된 복합체로 인식할 때, 교권 보호 정책은 기존에 신분 보장과 지위 향상의 요소들로 구성되었는데 이후 발생하는 문제를 해결하기 위해 기존 요소들에 교육권 보호의 요소가 추가되어 정책이 점진적으로 변화하였음을 이해할 수 있다. 그리고 경로진화 유형의 교권 보호 정책들은 대부분 경로 운영자인 정부의 재량 수준이 점차 낮아지고 시ㆍ도교육청과 학교의 역할이 증가하는 방향으로 변모하였는데, 이는 정책 집행에 있어 중앙집권적 방식보다 지방분권적 방식으로 전환하는 흐름과 일맥상통하다고 볼 수 있다.
  이를 바탕으로 다음의 정책적 제언을 제시하였다. 첫째, 교원의 권위 보호는 교원의 전문성 신장 정책으로 뒷받침되어야 한다. 둘째, 교원의 기본적 인권에 대한 사회적 인식의 제고가 필요하다. 셋째, 지역에 따른 교권 보장의 차이가 발생하지 않도록 해야 한다."
보육교사의 교권 인식 실태 및 교권 관련 보육정책 평가,윤나래,명지대학교 대학원,2021,국내석사,https://www.riss.kr/search/detail/DetailView.do?p_mat_type=be54d9b8bc7cdb09&control_no=a9227164e02a1e38ffe0bdc3ef48d419&keyword=교권침해,"본 연구는 보육교사의 교권 인식 실태와 실제 보육현장에서의 교권 실행실태를 알아보며 이를 통해 보육교사의 교권 신장을 위한 보육정책의 평가를 끌어내는 데에 그 목적이 있다. 보육교사의 교권의 영역은 선행연구의 구분 방식을 따라서 네 가지의 영역으로 나누어 교육상의 권리, 재산상의 권리, 노동에 관한 권리, 신분상의 권리로 구분한다. 연구 대상은 어린이집에 근무하고 있는 보육교사 296명으로 하였다. 자료 분석을 위해 SPSS 24.0 프로그램으로 빈도분석, 기술통계, Pearson 적률상관분석, 독립표본 T검정, 일원분산분석(ANOVA)을 실시하였으며, 연구 결과는 다음과 같다. 첫째, 보육교사의 교권에 대한 기대수준과 실제 수준의 차이가 있었으며, 둘째, 보육현장의 실제 교권 실행실태에서 교육권과 노동권의 실행 수준이 낮았으며 교권 이해와 교권 실행실태와 상관관계가 있었다. 셋째, 현장의 보육교사들은 여전히 교권 침해로부터 자유로울 수 없었고, 넷째, 보육교사의 교권 신장을 위한 현행 정책 및 새로운 정책의 발의가 요구되었다. 이러한 연구결과는 보육교사의 교권을 네 가지 영역으로 나누어 어떠한 영역에서 보완이 필요한지 알아볼 수 있었다는 것과 보육교사로 하여금 정책에 대한 관심도를 높이고 자신들의 권리 신장에 있어서 어떠한 정책이 필요할지 고민할 기회를 제공했다는 것에 시사점이 있다. 따라서 본 연구는 보육교사의 교권 신장을 위하여 교권인식 및 보육정책을 평가했다는 연구로서 의의가 있다. The purpose of this study is to find out the actual status of teachers' perception of teachers' rights and the actual implementation of teachers' rights at child care sites, thereby drawing an evaluation of child care policies to enhance teachers' rights. The area of teaching rights of child care teachers is divided into four areas according to the classification method of prior research, divided into educational rights, property rights, labor rights, and status rights. The subjects of the study were 296 child care teachers working at daycare centers.. For data analysis, frequency analysis, technical statistics, Pearson adequacy correlation analysis, independent sample T-test, and one-way analysis of variance (ANOVA) were conducted with the SPSS 24.0 program, and the results of the study were as follows. First, there was a difference between the level of expectations and the actual level of teachers' rights, and second, the level of practice of educational and labor rights in the actual practice of teachers' rights at child care sites was low, and it was correlated with the understanding of teachers' rights and the status of teachers' rights execution. Third, child care teachers at the site could still not be free from infringement of teachers' rights, and fourth, the current policy and the initiative of new policies for the enhancement of child care teachers' teaching rights were required. These findings suggest that the teacher's right to teach was divided into four areas to find out what areas need to be supplemented, and that the teacher was given the opportunity to raise interest in policies and consider what policies would be needed to enhance their rights. Therefore, this study is meaningful as a study that evaluated the recognition of teachers' rights and childcare policies for the enhancement of teachers' teaching rights."
교권에 대한 교사 기대와 현실 간의 차이 연구 : 서울특별시 공립 중학교 교사를 중심으로,최인재,한국교원대학교 대학원,2013,국내석사,https://www.riss.kr/search/detail/DetailView.do?p_mat_type=be54d9b8bc7cdb09&control_no=21f80913895477a7ffe0bdc3ef48d419&keyword=교권침해,"본 연구는 교권에 대해 교사의 기대와 현실의 차를 교권 내용별, 인적요인별, 배경변인별로 분석하고 그 이유에 대한 교사의 인식을 파악하여 학교 현장의 교권 보장 실태를 밝히고 교권 확립과 관련한 방안 마련에 있어 의미있는 정보를 제공하고자 한다. 이와 같은 연구의 목적을 달성하기 위해 다음과 같은 연구문제를 설정하였다.  
첫째, 교권에 대한 교사의 기대와 현실은 교권내용 별로 어떠한 차이를 가지는가?
둘째, 교권에 대한 교사의 기대와 현실은 교권과 관련한 인적요인 별로어떠한 차이를 가지는가?
셋째, 교권에 대한 교사의 기대와 현실의 차가 나타나는 이유는 무엇인가?
이상의 연구문제를 해결하기 위해 먼저 문헌연구를 바탕으로 교권 개념을 교원의 직업적 권위와 권리로 규정하고 그 내용을 수업권, 학생생활지도권, 학교경영참여권, 자기개발권, 교원에 대한 예우, 신분 보장 및 구제권, 보수 등 청구권으로 구체화한 후 이를 바탕으로 설문지를 구성하여 설문을 실시하였다. 
설문을 분석한 연구 결과를 요약하면 다음과 같다. 
첫째, 교권 내용별 보장 수준에 대한 교사의 기대와 현실의 차는 보수 등 청구권, 교원에 대한 예우, 학교경영참여권 순으로 크게 나타났다.  
둘째, 교권 보장에 대한 인적요인별 기대-현실의 차는 학교장 등 관리자와 학부모 등 사회에서 가장 크게 나타났다.
셋째, 교권 내용별 교사의 기대와 현실 간의 차이가 나타나는 원인으로 학교경영참여권, 신분보장 및 구제권, 보수 등 청구권은 제도·정책적 원인, 수업권과 학생생활지도권, 교원에 대한 예우는 인적·사회적 원인,  자기개발권은 교사원인과 제도적·정책적 원인의 혼합으로 나타났다. 또한 인적요인과 관련된 원인으로 학생은 가정교육 및 인성교육의 부재, 학부모 등 사회의 경우 자기 자녀에 대한 지나친 이기주의, 학교장 등 관리자의 경우 학교현장을 무시한 정책 및 업무 지시, 동료 교사의 경우 문제 해결을 위한 협동적 노력의 부족 등이 주 원인으로 나타났다. 
이와 같은 결과를 바탕으로 결론을 제시하면 다음과 같다. 
첫째, 교사의 교권 내용별 기대 현실의 차를 줄이기 위해서는 교사의 전문성에 걸맞는 보수 수준의 확보, 성과급 등 기타 수당의 공정한 지급, 교사의 사회적 지위 향상, 학교경영에의 참여 기회 확대 등이 우선적으로 필요하다. 
둘째, 교권 보장에 대한 인적요인별 기대-현실의 차를 줄이기 위해서는 국가적 차원에서 교원 보수수준의 향상과 교원의 사회적 지위 향상을 위한 정책적 노력, 교사의 수업 자율성 보장 등이 우선적으로 필요하며 교사를 존경하는 사회적 환경 조성을 위해 학부모와 언론 등의 신중한 자세가 필요하다. 
셋째, 교권에 대한 기대-현실의 차이가 나타나는 원인은 교권 내용별, 교권 관련 인적요인별로 상이하게 나타나므로 교권보장을 위한 방안을 마련하기 위해서는 이에 대한 고려가 필요하다."
