title,writer,publisher,year,journal,link,abstracts
교사의 정서적 자기이해 체험,이영아,忠南大學校 大學院,2017,국내박사,https://www.riss.kr/search/detail/DetailView.do?p_mat_type=be54d9b8bc7cdb09&control_no=221ab5b5ece3ca31ffe0bdc3ef48d419&keyword=교권침해,"교사의 정서적 자기이해 체험

이영아

충남대학교 대학원 교육학과 교육심리학·교육과정전공
(지도교수 손 은 령)


본 연구는 최근 학교 현장에서 교권 침해 및 소진을 경험하고 있는 교사들이 자신의 정서를 인식하고 수용하며 자기이해를 경험함으로써 궁극적으로 학생들과 어떻게 만나고 성장해나가는지를 van Manen의 체험 연구의 절차를 적용하여 알아보고자 하였다. 이에 교사들의 정서적 자기이해 체험의 내용은 무엇이고, 어떠한 과정을 거치는가, 또한 체험의 교육적 의미와 본질적 주제는 어떤 것인지를 현상학적 물음을 제기함으로써 살펴보고자 하였다. 
본 연구에서는 연구 참여자1과 2를 2010년 9월부터 2015년 2월까지 10번 이상의 교육 분석과 정서 초점적 상담을 진행하였고. 이후 이 과정에 대한 참여관찰과 심층면담 및 관련 자료 등을 수집하여 체험의 내용과 의미를 찾고자 하였다. 참여관찰과 심층면담을 통해 수집된 자료는 먼저 체험의 내용을 일화 형식으로 기술하고, van Manen의 생활세계의 주제가 되는 네 개의 실존체인 시간, 공간, 신체, 관계에 따라 체험의 양상을 분석하였다. 또한 체험에 대한 본질적 의미를 찾고자 Heidderger의 현존재 분석과 Gadamer의 교육적 해석학에 입각하여 드러난 체험의 내용을 해석학적 순환과 확장으로 재해석하고자 노력하였다. 
네 개의 실존체를 통해 분석한 체험의 내용은 다음과 같다. 첫째 시간과 공간 차원에서 두 교사는 돌이킬 수 없는 과거의 시․공간을 살아가다가 정서적으로 자기를 이해하는 과정을 겪으면서 지금, 여기에서 현존하는 존재방식으로 살아가게 된다. 둘째 신체와 관계 차원에서 두 교사는 자기의 몸에 관심을 갖게 되면서 비로소 홀로 살아가던 삶의 방식을 벗어나 학생들에게 관심을 갖게 되어 진정한 만남을 경험하게 된다. 이 체험의 내용은 정서적 자기이해를 체험한 교사가 과거에서 현재로, 자기 폐쇄성에서 자기 개방성으로 변화하는 과정을 드러내고 있다. 
교사의 정서적 자기이해에 대한 체험의 의미는 3가지의 대주제와 12가지 하위 주제로 나누어 살펴보았다. 3가지 대주제는 시간에 따른 연구 참여자의 역동적 변화 양상에 비추어 어둠 속에서 홀로 헤매다가 정서적 자기 이해를 통해 상징적으로 은밀한 빛을 경험하게 되고 궁극적으로 학생들과의 만남을 통해 함께 성장하는 것으로 해석하였다. 첫째, 어둠 속에서 홀로 헤매던 두 교사는 불안과 우울로부터 도망치고, 정서에 대핸 부정적으로 평가하며, 학생과의 만남에서 일방적인 소통을 하면서 교사 역할로서의 가면극에 빠져 살아가고 있다. 둘째, 두 교사는 정서적 자기이해를 경험하면서 의미 있는 타인으로부터 있는 그대로 존중받고, 자신의 정서를 알아차리며, 지금-여기에서 현존하는 자기를 이해하고 수용하면서 처음으로 자유를 누리게 된다. 셋째, 정서를 통해 자기이해를 경험한 두 교사는 학생들에 대해 관심을 갖게 되고 진정한 만남을 경험하면서 갈등을 통해 새롭게 배워나가며 마침내 자기 존재로써 학생들을 가르치게 된다. 
본 연구의 결론은 해석학적 반성과 순환에 의해 연구 결과의 의미를 재해석하고자 하였다. 연구결과에서 드러난 세 가지 의미는 교육철학적 해석학의 입장에서 첫째, 교사는 실존적 불안과 우울감을 토대로  현존재로서의 자기이해 과정을 경험하는 것, 둘째, 교사는 정서적 자기이해를 통해 세계-내-존재로 자신을 둘러싼 세계와 의미 있는 타인들에 대해 관심을 두고 진정으로 이해하게 되는 것, 셋째, 마침내 공동체의 인간성인 ‘사이존재’로서 ‘나’와 ‘너’가 인격적으로 만나면서 함께 성장하며 살아가게 되는 것으로 요약할 수 있다. 
본 연구는 교사의 정서를 통한 교육적 성장에 대한 체험 내용과 의미를 새롭게 구성하고 실천적 대안으로 교사 교육 및 학생 교육에서 정서적 교육과정과 집단프로그램이 도입되어야 할 것을 제언하였다. 그러나 연구자를 포함한 두 교사의 사례로는 교육 현장에서의 적용과 일반화에는 어려움이 있다. 또한 교사교육과 학생 교육과정에서 정서적 자기이해를 위한 프로그램의 내용과 방식에 대한 구체적 제안이 이루어지지 않은 점에서 연구의 제한점이 있으므로 후속 연구가 필요하다고 볼 수 있다. 

주제어 : 교사의 정서, 자기이해, 현존재, 체험연구, 해석학적 현상학 ABSTRACT A dissertation submitted to the committee of Graduate School, Chungnam National University in a partial fulfillment of the requirements for the degree of Doctor of Education conferred in August 2017.




Teachers' emotional self-understanding experience

Young-Ah Lee 


Education Psychology and Curriculum
Department of Education, Graduate School
Chungnam National University
Daejeon, Korea


(Supervised by Professor Eun-Young Son)


The purpose of this study was to find out how the teachers who experienced violation of teacher rights and energy exhaustion in the school field perceived their emotions and how they meet and grow with students through self-understanding by accepting them through van Manen's experiential research method . Therefore, this researcher tried to examine what the contents of the experience of emotional self-understanding of teachers are, what kind of process they are going through, and the educational meaning and essential theme of experience by raising the phenomenological question.
From September 2010 to February 2015, the author conducted more than a ten times training analyzes and emotional focus counseling for two research participants. In addition, the author observed this process, conducted in-depth interviews, and collected relevant data to find out the content and meaning of the experience of the participants. The data collected through participation observation and in-depth interview first describe the contents of the experience in anecdotal form and analyze the aspect of experience according to the four existential essence of van Manen 's life world, time, space. In addition, the author tried to reinterpret the contents of experience revealed by Heidderger's analysis of Dasein and Gadamer' s educational hermeneutics as hermeneutical circulation and expansion.
The contents of the experience analyzed through four existential essences are as follows. First, in the time and space dimension, the two teachers experience emotional self-understanding while living the irreversible past time and space, and live in the way of 'Dasein'. Second, in the relationship between the body and the relationship, the two teachers become interested in their own body, so they become interested in the students and experience a true meet. The content of this experience reveals the process in which the teacher who experienced emotional self-understanding changes from past to present, from self-closeness to self-opening.
The meaning of the experience of teacher 's emotional self-understanding was divided into three main topics and 12 sub-topics. The authors interpreted the three major themes as dynamic changes of the participants according to the time, and the authors found that the research participants experienced the symbolic secret light through emotional self-understanding while wandering alone in the dark, and The teacher and the student meet and they grow together. 
First, the two teachers who wandered alone in the dark escaped from anxiety and depression and evaluated their emotions negatively. This phenomenon shows that the two teachers live in a one-way communication with the students and act as the actors of the plays that simply play the teacher role. Second, the two teachers experience emotional self-understanding and are properly respected by others who are meaningful, so that the two teachers, while understanding their emotions, find the present selves in ""now & here"" and seek freedom for the first time. Third, the two teachers who have experienced self-understanding through emotions experience a real encounter as they become interested in students, learn new things through conflicts, and finally meet students through true self.
In conclusion, the author attempted to reinterpret the meaning of the study results by hermeneutical reflection and hermeneutical circulation. From the standpoint of educational philosophical hermeneutics, the three meanings revealed in the study are as follows. First, the teacher experienced the process of self-understanding as 'Dasein' based on the anxiety and depression of existence. Secondly, through the emotional self-understanding, the teacher became interested in the world around him and others meaningful as 'world-in -being' and really understood. Third, at last, we are a community with humanity, 'I' and 'you' meet on the basis of personality and grow together.
This study suggests that emotional curriculum and group program should be introduced to teachers' education and student education as a practical alternative that teachers experience educational growth through emotion and newly construct contents and meaning. However, due to the limitations of the two teachers including the researcher, it would be difficult to apply and generalize such a program to the educational field. In addition, there is a limit to the study because there is no specific suggestion about contents and method of emotional self-understanding in teacher education and student curriculum. Therefore, follow-up research is needed.

Key words : Teacher's emotions, Self-understanding, Dasein, 
            Experiential research, Hermeneutic phenomenology

"
교육에서의 합리주의: 비판적 고찰,박진희,서울교육대학교 교육대학원,2013,국내석사,https://www.riss.kr/search/detail/DetailView.do?p_mat_type=be54d9b8bc7cdb09&control_no=e4a1c4668ae58dcaffe0bdc3ef48d419&keyword=교권침해,"본 논문의 목적은 교육에 만연한 합리주의적 사고를 비판적으로 검토하고 전통적으로 추구되어온 교육의 바람직한 모습을 제시하고자 하는 데에 있다.
  사람들은 현재의 학교 교육이 단편적 지식 교육, 입시 위주의 교육, 교실 붕괴, 교권 침해 등의 많은 문제들을 안고 있다고 말한다. 그리고 이는 학교가 시대적 요구에 부응하지 못하고 전통적으로 행해져온 교육의 내용과 방법을 적절히 변화시키지 않았기 때문이라고 지적한다. 합리주의자들이 본 학교 교육의 가장 큰 문제점은 학교에서 교사는 외부로부터 이미 정해진 지식을 학습자의 요구와 필요와는 관계없이 무조건적으로 강요하여 가르친다는 것이다. 이에 따라 듀이(J. Dewey)로 대표되는 진보주의 교육철학과 구성주의적 인식론이 뒷받침된 교육과정의 재편성과 교육방법의 혁신적 변화가 일기 시작하였다. 
  교육 내용을 선정하는 데에 학습자 개인의 ‘필요’나 ‘욕구’와 같은 내적 요소가 중요시되었다. 진보주의 교육자들은 학습자의 개인적 경험과 밀접한 관련이 있을 때만이 개인에게 의미 있는 교육이 가능하다고 주장하기 때문이다. 듀이에 의하면 교과는 현재를 이해하는 ‘수단’으로 활용될 때만이 교육적으로 가치를 지니므로 교과 지식의 준거는 오로지 ‘유용성’에 있다.
  이에 따라 교육방법 역시 교사 중심의 설명 및 시범 위주의 강의식 수업에서 학습자 중심의 활동 위주의 수업으로 변화하게 된다. 지식을 고정된 진리로 보는 객관주의 인식론과는 달리 구성주의 인식론에서 지식이란 인식 주체인 학습자에 의해서 자발적으로 구성되는 것이다. 구성주의에서 학습자 개인은 구성주의적 학습 환경만 조성된다면 스스로 지식을 구성해 나갈 수 있는 능동적 존재로 간주되기 때문에 교사는 여러 수업매체중의 하나에 불과하다.
  이와 같은 합리주의적 교육관에 따르면 지식의 준거는 유용성이고 교사는 여러 교육매체 중 하나이다. 그러나 이러한 합리주의적 교육관에는 행위를 이끄는 실천적 지식이 무엇인지에 대한 이해가 결여되어 있다. 지식은 이론적 성찰의 대상이 되는 명제적 지식인 ‘기법적 지식’과 오로지 수행되는 과정을 통하여 그 모습을 드러내는 ‘실제적 지식’으로 이루어져 있다. 교사가 전달하는 것처럼 보이는 기법적 지식은 실지로 실천적 성격을 가진 실제적 지식인 것이다. 교사는 자신만의 독특한 발화와 행위를 통해 행위를 이끌어 내는 실제적 지식을 전수할 수 있는 유일한 존재이다. 
  사람들이 교육을 외재적 목적 달성을 위한 수단으로 간주하기 훨씬 이전부터, 교육은 자유교육이라는 이름 아래 지식의 추구를 통한 마음의 발달로 여겨져 왔다. 대표적인 자유교육론자인 오우크쇼트(M. Oakeshott)는 그의 후기 저작을 통하여 교육을 통해 인간이 누리게 되는 자유를 ‘대화’ 개념으로 설명한다. 교육이란 시적 대화로의 입문이다. 즉, 교육이란 여러 목소리들이 위계를 가지지 않고 서로 어울릴 수 있는 인류의 대화의 장으로 한 인간을 초대하는 것이다. 한 인간이 인류의 대화에 입문한다는 것은 자신만의 생각이 옳다는 아집에서 벗어나 다른 생각을 존중할 수 있는 자유를 얻게 되었다는 것을 의미하기 때문이다. 오우크쇼트가 설명한 대화 개념은 ‘자기 이해’에 기반한 자유 교육이 무엇인지를 보다 명확하게 드러내기 위한 핵심 개념이다. 
  학생이 학교에서 공부한 후 얻게 되는 자유 역시 시적 상상 활동을 통하여 얻게 되는 자유와 다른 것이 아니다. 학교에서 학생이 얻는 희열은, 학생이 교사를 통하여 ‘개체’의 이미지로서 주어지는 인류의 문명 유산을 향유하면서 자기 자신의 이미지를 만들어 볼 기회를 얻는 데서 오는 희열이다. 학생은 학교 교육을 통하여 외재적 목적으로부터 해방되어 자기 이해를 향한 지적 모험의 기회를 마음껏 누릴 수 있게 된다. 학생은 교육, 즉 시적 대화로의 입문을 통해 그 동안 자신이 당연히 사실로 여기는 것들을 가능성으로 환원할 수 있는 기회를 얻고 점차 아집에서 벗어날 수 있게 된다. 
  인간은 오로지 교육적 영위를 통하여 ‘인간다움’의 자유를 누릴 수 있다. 합리성, 유용성으로 선별된 지식을 학습하는 것이 결코 인간다움을 이끌어내지 않는다. 잘 교육 받은 사람이란 실제적이고 유용한 기술을 많이 수행할 수 있는 사람이나 학문적인 지식을 유창하게 나열할 수 있는 사람을 가리키는 것이 아니라, 지식의 내면화를 통해 보다 성숙한 지적 안목을 가진 인간다운 사람을 가리키는 것이다. 그리고 이러한 인간다움은 학습을 끝낸 후 얻게 되는 성취물이 아니라 교육적 영위를 누리는 과정 중에 얻게 되는 희열이다. 그러므로 교육적 행위는 어떤 여타의 외재적 목적을 그 종착점으로 취하는 수단적 행위가 아니라, 그 자체만으로 충분히 내재적 의미를 가지는 인간적 영위로서 설명되어야 마땅하다."
학부모 교육정책의 개선 방안 연구 : 경기도교육청의 학부모 교육 정책을 중심으로,박영희,경인교육대학교 교육전문대학원,2024,국내석사,https://www.riss.kr/search/detail/DetailView.do?p_mat_type=be54d9b8bc7cdb09&control_no=29887e05619723b5ffe0bdc3ef48d419&keyword=교권침해,"학부모 교육정책의 개선 방안 연구 -경기도교육청의 학부모 교육 정책을 중심으로- 박영희 정치시민교육학과전공 경인교육대학교 교육전문대학원 교육 현장에서 학부모와 학생, 학교(교사)는 ‘교육의 3주체’이다. 3주체가 서로 지원과 협력하여 교육을 이끌어간다. 그러나 공교육 현장은 이와 같은 균형적 삼각구도와 달리 작동한다. 학부모와 학생, 학교(교사)는 서로를 불 신·반목하며, 갈등의 골이 심각한 상태이다. 불신의 늪에 빠져 서로를 폄하 하기에 급급하다. 교육공동체의 균형적 협력은 찾아볼 수 없다. 한편에서는 권리만을 주장하고, 또 다른 한편에서는 방관 또는 배척한다. 최근 ‘학부모 갑질’도 앞에서 언급한 균형적 삼각구도가 작동하지 않아서 그렇다. 학부모는 학교(교사)와 소통하며 협력 및 지원하는 교육의 동반자이 자 협력자이다. 그럼에도 일부 학부모의 교사(학교) 괴롭히기식 민원과 교권 침해 등이 발생하고 있다. 학교 역시, 학부모를 성가신 대상으로 여기고 교 육 현장에서 학부모의 교육 참여를 배척하거나 방치 또는 외면하고 있다. 나아가 학생(학부모)들이 공교육에서 탈피하여 사교육으로 빠져들고 있다. 공교육에서 발을 빼고, 사교육을 통한 각자도생(各自圖生)의 길을 선택한 것 이다. 사교육의 확장은 교육의 양극화를 더욱더 심화시킨다. 무엇보다 소외 계층의 건강한 교육은 더욱 피폐해지고, 양극화의 골은 더욱 깊어져 사회적 갈등으로 이어졌다. 그 원인은 다양하겠으나 교육정책이 중심을 잡지 못하 고 수시로 변하는 것도 큰 요인 중 하나이다. 무엇보다 교육의 한주체로 활 동하는 학부모를 위한 법적, 제도적 뒷받침 방안이 마련되어 있지 못한 것 도 큰 원인이라고 볼 수 있다. 이 같은 문제를 개선하는 소박한 방안을 찾는 것이 이번 연구의 목적이 다. 개선 방안은 다양하게 있겠으나 이번 연구는 학부모의 교육주체화에서 방안을 찾고자 한다. 연구의 방법으로 선행연구를 분석하고, 당사자인 학부모들의 대안을 찾아 내는 설문과 교육청의 학부모 업무 담담자 인터뷰를 통해 학부모 교육의 문 제점과 개선을 방안을 도출하였다. 연구 결과에 따르면, 학부모들은 학교(교사)가 학부모를 바라보는 ‘부정적 인 시각’에 대한 부담이 크다. 또 학부모들은 생업활동에 따른 여건상 교육 참여 활동을 못하고 있다. 대안으로는 “학부모 활동에 대한 법적 지원”을 최우선 개선 과제로 제시 하였다. 교육 현장에서는 학부모를 ‘귀찮은 존재’로 여기는 경향이 있다. 적 어도 학부모들은 “그렇게 느끼고, 그래서 불편하다”는 것이다. 교육에 대한 법적 권한 여부를 떠나 학부모는 자녀의 교육에 함께할 수밖에 없는 최종적 보호자임은 부인할 수 없는 사실이다. 그런 학부모들을 귀찮은 존재가 아닌 교육공동체의 한 주체로 인정할 수 있도록 법적 제도적 뒷받침이 조속히 이 뤄져야 할 필요성이 있다."
